{
  "schema_version": "1.0",
  "dataset_id": "libuv-sync-v1",
  "repository": "https://github.com/libuv/libuv",
  "commit": "8fb9cb919489a48880680a56efecff6a7dfb4504",
  "source_files": {
    "third_party/libuv/src/threadpool.c": "e0db34c1bf86f020cc49285a5c3fcc383e9bd2ed7b0b959b5462624705d5322e",
    "third_party/libuv/src/unix/async.c": "25f5834d39bc58d25ba0a1214597522e4f811ab9be1bf8ee549f0a74a623e552",
    "third_party/libuv/src/unix/linux.c": "81346c3dd34c836610c774893d126780d48bd6637e8b7c79e9b9bbed4213abc3",
    "third_party/libuv/src/unix/thread.c": "00eb9de2161ff4c8435c691069416f0bf6faaddb8118a276704cd7dd07039c2c"
  },
  "review": {
    "method": "source_review_by_ai",
    "human_review": "confirmed",
    "human_confirmed_at": "2026-10-28"
  },
  "samples": [
    {
      "id": "sync_001_queue_publication",
      "relation_type": "mutex_lock",
      "source": {
        "function": "post",
        "thread": "submitter",
        "shared_object": "wq",
        "held_locks": [],
        "evidence_ids": [
          "sync_001_queue_publication_source"
        ],
        "operation": "uv_mutex_unlock(&mutex);"
      },
      "target": {
        "function": "worker",
        "thread": "worker",
        "shared_object": "wq",
        "held_locks": [
          "mutex"
        ],
        "evidence_ids": [
          "sync_001_queue_publication_target"
        ],
        "operation": "q = uv__queue_head(&wq);"
      },
      "claim_order": "happens_before",
      "order": "happens_before",
      "label": "positive",
      "classification": "consistent",
      "condition": "同一队列项已由 post 发布且被 worker 取出",
      "reason": "post 解锁与随后 worker 对同一 mutex 的获取建立队列发布顺序。",
      "confidence": 0.95,
      "evidence": [
        {
          "id": "sync_001_queue_publication_source",
          "file": "third_party/libuv/src/threadpool.c",
          "line": 160,
          "snippet": "uv_mutex_unlock(&mutex);"
        },
        {
          "id": "sync_001_queue_publication_target",
          "file": "third_party/libuv/src/threadpool.c",
          "line": 81,
          "snippet": "q = uv__queue_head(&wq);"
        },
        {
          "id": "sync_001_queue_publication_support_66",
          "file": "third_party/libuv/src/threadpool.c",
          "line": 66,
          "snippet": "uv_mutex_lock(&mutex);"
        },
        {
          "id": "sync_001_queue_publication_support_157",
          "file": "third_party/libuv/src/threadpool.c",
          "line": 157,
          "snippet": "uv__queue_insert_tail(&wq, q);"
        }
      ],
      "build_profile": "linux-posix-static-source"
    },
    {
      "id": "sync_002_idle_before_wait",
      "relation_type": "condition_variable",
      "source": {
        "function": "worker",
        "thread": "worker",
        "shared_object": "idle_threads",
        "held_locks": [
          "mutex"
        ],
        "evidence_ids": [
          "sync_002_idle_before_wait_source"
        ],
        "operation": "idle_threads += 1;"
      },
      "target": {
        "function": "worker",
        "thread": "worker",
        "shared_object": "idle_threads",
        "held_locks": [
          "mutex"
        ],
        "evidence_ids": [
          "sync_002_idle_before_wait_target"
        ],
        "operation": "uv_cond_wait(&cond, &mutex);"
      },
      "claim_order": "happens_before",
      "order": "happens_before",
      "label": "positive",
      "classification": "consistent",
      "condition": "同一次等待迭代",
      "reason": "等待前在 mutex 内递增 idle_threads；wait 会释放并重新获取 mutex。",
      "confidence": 0.95,
      "evidence": [
        {
          "id": "sync_002_idle_before_wait_source",
          "file": "third_party/libuv/src/threadpool.c",
          "line": 76,
          "snippet": "idle_threads += 1;"
        },
        {
          "id": "sync_002_idle_before_wait_target",
          "file": "third_party/libuv/src/threadpool.c",
          "line": 77,
          "snippet": "uv_cond_wait(&cond, &mutex);"
        }
      ],
      "build_profile": "linux-posix-static-source"
    },
    {
      "id": "sync_003_wait_reacquire",
      "relation_type": "condition_variable",
      "source": {
        "function": "worker",
        "thread": "worker",
        "shared_object": "idle_threads",
        "held_locks": [
          "mutex"
        ],
        "evidence_ids": [
          "sync_003_wait_reacquire_source"
        ],
        "operation": "uv_cond_wait(&cond, &mutex);"
      },
      "target": {
        "function": "worker",
        "thread": "worker",
        "shared_object": "idle_threads",
        "held_locks": [
          "mutex"
        ],
        "evidence_ids": [
          "sync_003_wait_reacquire_target"
        ],
        "operation": "idle_threads -= 1;"
      },
      "claim_order": "happens_before",
      "order": "happens_before",
      "label": "positive",
      "classification": "consistent",
      "condition": "uv_cond_wait 成功返回",
      "reason": "返回后持有 mutex，才递减 idle_threads。",
      "confidence": 0.95,
      "evidence": [
        {
          "id": "sync_003_wait_reacquire_source",
          "file": "third_party/libuv/src/threadpool.c",
          "line": 77,
          "snippet": "uv_cond_wait(&cond, &mutex);"
        },
        {
          "id": "sync_003_wait_reacquire_target",
          "file": "third_party/libuv/src/threadpool.c",
          "line": 78,
          "snippet": "idle_threads -= 1;"
        }
      ],
      "build_profile": "linux-posix-static-source"
    },
    {
      "id": "sync_004_signal_not_dispatch",
      "relation_type": "condition_variable",
      "source": {
        "function": "post",
        "thread": "submitter",
        "shared_object": "cond/wq",
        "held_locks": [
          "mutex"
        ],
        "evidence_ids": [
          "sync_004_signal_not_dispatch_source"
        ],
        "operation": "uv_cond_signal(&cond);"
      },
      "target": {
        "function": "worker",
        "thread": "worker",
        "shared_object": "cond/wq",
        "held_locks": [],
        "evidence_ids": [
          "sync_004_signal_not_dispatch_target"
        ],
        "operation": "w->work(w);"
      },
      "claim_order": "happens_before",
      "order": "unknown",
      "label": "negative",
      "classification": "unknown",
      "condition": "没有识别具体被唤醒线程或队列项",
      "reason": "signal 不保证唤醒特定 worker，也不能将任意 work 与该 signal 配对。",
      "confidence": 0.95,
      "evidence": [
        {
          "id": "sync_004_signal_not_dispatch_source",
          "file": "third_party/libuv/src/threadpool.c",
          "line": 159,
          "snippet": "uv_cond_signal(&cond);"
        },
        {
          "id": "sync_004_signal_not_dispatch_target",
          "file": "third_party/libuv/src/threadpool.c",
          "line": 123,
          "snippet": "w->work(w);"
        }
      ],
      "build_profile": "linux-posix-static-source"
    },
    {
      "id": "sync_005_slow_counter_increment",
      "relation_type": "mutex_lock",
      "source": {
        "function": "worker",
        "thread": "worker",
        "shared_object": "slow_io_work_running",
        "held_locks": [
          "mutex"
        ],
        "evidence_ids": [
          "sync_005_slow_counter_increment_source"
        ],
        "operation": "slow_io_work_running++;"
      },
      "target": {
        "function": "worker",
        "thread": "worker",
        "shared_object": "slow_io_work_running",
        "held_locks": [],
        "evidence_ids": [
          "sync_005_slow_counter_increment_target"
        ],
        "operation": "uv_mutex_unlock(&mutex);"
      },
      "claim_order": "happens_before",
      "order": "happens_before",
      "label": "positive",
      "classification": "consistent",
      "condition": "同一次慢 I/O 调度",
      "reason": "计数递增发生在全局锁释放之前。",
      "confidence": 0.95,
      "evidence": [
        {
          "id": "sync_005_slow_counter_increment_source",
          "file": "third_party/libuv/src/threadpool.c",
          "line": 106,
          "snippet": "slow_io_work_running++;"
        },
        {
          "id": "sync_005_slow_counter_increment_target",
          "file": "third_party/libuv/src/threadpool.c",
          "line": 120,
          "snippet": "uv_mutex_unlock(&mutex);"
        }
      ],
      "build_profile": "linux-posix-static-source"
    },
    {
      "id": "sync_006_slow_counter_decrement",
      "relation_type": "mutex_lock",
      "source": {
        "function": "worker",
        "thread": "worker",
        "shared_object": "slow_io_work_running",
        "held_locks": [
          "mutex"
        ],
        "evidence_ids": [
          "sync_006_slow_counter_decrement_source"
        ],
        "operation": "uv_mutex_lock(&mutex);"
      },
      "target": {
        "function": "worker",
        "thread": "worker",
        "shared_object": "slow_io_work_running",
        "held_locks": [
          "mutex"
        ],
        "evidence_ids": [
          "sync_006_slow_counter_decrement_target"
        ],
        "operation": "slow_io_work_running--;"
      },
      "claim_order": "happens_before",
      "order": "happens_before",
      "label": "positive",
      "classification": "consistent",
      "condition": "is_slow_work 为真",
      "reason": "回调结束后重新获取 mutex 再递减慢 I/O 计数。",
      "confidence": 0.95,
      "evidence": [
        {
          "id": "sync_006_slow_counter_decrement_source",
          "file": "third_party/libuv/src/threadpool.c",
          "line": 134,
          "snippet": "uv_mutex_lock(&mutex);"
        },
        {
          "id": "sync_006_slow_counter_decrement_target",
          "file": "third_party/libuv/src/threadpool.c",
          "line": 137,
          "snippet": "slow_io_work_running--;"
        }
      ],
      "build_profile": "linux-posix-static-source"
    },
    {
      "id": "sync_007_callback_outside_mutex",
      "relation_type": "mutex_lock",
      "source": {
        "function": "worker",
        "thread": "worker",